<?xml version="1.0"?>
<xsd:schema xmlns:xsd="http://www.w3.org/2001/XMLSchema">
  <xsd:element name="catalog">
    <xsd:complexType>
      <xsd:sequence>
        <xsd:element name="GameList" 
                     minOccurs="0" 
                     maxOccurs="unbounded">
           <xsd:complexType>
              <xsd:sequence>
                 <xsd:element name="title" type="xsd:string"/>
                 <xsd:element name="publisher" type="xsd:string"/>
                 <xsd:element name="genre" type="xsd:string"/>
                 <xsd:element name="price" type="xsd:float"/>
                 <xsd:element name="date_released" type="xsd:date"/>
                 </xsd:sequence>
               <xsd:attribute name="id" type="xsd:string"/>
          </xsd:complexType>
        </xsd:element>
      </xsd:sequence>
    </xsd:complexType>
  </xsd:element>
</xsd:schema>